msgid,msgstr
"\n%$$%This box is another take on a hinge box.\n%$$%The hinges doesn't protrude from the box, but the sides needs double walls.\n%$$%When opened, 2 sides are opening, improving access inside the box.\n%$$%An optional latch is included, based on a mechanical switch and a 3D printed %$$%button.\n%$$%The latch is one-way: the box can be closed freely\n%$$%(this side of the button is angled, and totally smooth since it's the %$$%printing bed surface),\n%$$%but can't be inadvertently opened.\n",
"add one or two latches, based on 3D printing and a cherry mx compatible %$$%mechanical keyboard switch",
\n%$$%Cuttlery stand with carrying grip\n%$$%using flex for rounded corners\n,
"Best cut from 5mm material to match the original. Use the included washers %$$%to mount. The board needs space towards the wall for hooks to go into.\n%$$%\n%$$%You can use boxes and holders from the \""WallMounted\"" group with \""skadis\"" %$$%as \""walltype\"". Note that these generators do not have any support to pick %$$%the right width(s). Inner distance between slots are 35 + n * 40 mm. It is %$$%recommended to cut the acceessories from 4 mm material. Then 36 + n * 40 mm %$$%should be used for inner widths. Deselect \""outside\"" where available to be %$$%able to deal with inner measurements.",
Can be used as a display or for cards or gaming tokens. Lay on the side to %$$%get piles to draw from.\n%$$%    ![Example Use](static/samples/SlantedTray-2.jpg),
"* The sliding lid rests on the lower rails and is kept in place by the upper %$$%rails.\n%$$%* When using inner measurements, the height goes from bottom to lid, the %$$%lower rail is inside of the inner height.\n%$$%* The width of the rail can be adjusted, wider rails are more stable but %$$%make the opening smaller.\n%$$%* The horizontal margin makes the lid slightly narrower to prevent the lid %$$%from jamming.\n%$$%* The vertical margin makes the gap between the rails larger to let the lid %$$%slide more easily.\n%$$%\n%$$%![Closed](static/samples/SlidingLidBox-2.jpg)\n",
Assemble inside out. If there are inner front to back walls start with %$$%attaching the floor boards to them. Then add the vertical inner left to %$$%right walls. After sliding in the slopes attach the outer wall to fix %$$%everything in place.\n%$$%\n%$$%If there are no inner front to back walls just add everything to one side %$$%wall and then add the other one after that. Possibly saving the front and %$$%back as last step.,
\n%$$%\n%$$%Drawers are not included:\n%$$%\n%$$%![Inside](static/samples/StorageRack-2.jpg)\n%$$%![Back wall details](static/samples/StorageRack-3.jpg)\n%$$%\n,
"The traffic light was created to visualize the status of a Icinga monitored %$$%system.\n%$$%\n%$$%When turned by 90°, it can be also used to create a bottle holder.\n",
Tray insert without floor and outer walls - allows only continuous walls,
"## Tray/Box insert dividers.\n%$$%Tray insert with extra margin for that perfect fit.\n%$$%\n%$$%You can specify the grid sizes with the standard `(sx, sy)` format, which %$$%allows nice\n%$$%variable rows and columns.  If you  check the `outside` box, the full %$$%outside of the\n%$$%tray insert ends up being the sum of all the sx/sy values.  However, if you %$$%want a\n%$$%consistent cell size, and uncheck outside, then the overall dimensinos end %$$%up\n%$$%larger by `(n-1)*thickenss`, to make space for your walls.\n%$$%\n%$$%You can specify the `x` and `y` parameters if you like, just make them %$$%larger than\n%$$%what the sum of `(sx, sy)` would end up with, and the walls be automatically %$$%extended to\n%$$%to exactly fill the inside of your tray or box.\n%$$%\n%$$%So, for example, if you're fitting `30mm x 40mm` items and want them to\n%$$%fit inside a `250mm x 300mm` box, you can specify\n%$$%\n%$$%    sx = 30*8\n%$$%    sy = 40*7\n%$$%    uncheck outside\n%$$%    x=250\n%$$%    y=300\n%$$%\n%$$%This frees your mind into separately thinking about the cell size vs the %$$%overall box size.\n%$$%\n%$$%![Tray Extra](static/samples/TrayInsert-3.jpg)\n%$$%    ",
A two piece box where top slips over the bottom half to form the enclosure.,
\n%$$%Set *hi* larger than *h* to leave gap between the inner and outer shell. %$$%This can be used to make opening the box easier. Set *hi* smaller to only %$$%have a small inner ridge that will allow the content to be more visible %$$%after opening.\n%$$%\n%$$%![Bottom view](static/samples/TwoPiece2.jpg)\n,
"which edges are flat (e) or grooved (z,Z), counter-clockwise from the front",
"\""stud\"" to brace against the wall, \""hook\"" for attaching to a second cleat %$$%or \""none\"" for just straight",
"\n%$$%####Assembly Notes:\n%$$%1. The generator produces three pieces with angled finger joints.\n%$$%Bottom panel, sloped front panel and label panel (if enabled).\n%$$%2. Joint lengths vary to accommodate the slope angles.\n%$$%3. Orient pieces as shown in the generated layout to assemble correctly.\n",
height of the front plate (in mm) - needs to be at least 7 time the thickness,
"\n%$$%####Features:\n%$$%- Configurable dimensions (width, height, depth)\n%$$%- Adjustable front slope angle for easy access\n%$$%- Optional label area on front face\n%$$%- Stackable design with interlocking geometry\n%$$%- Multiple wall mounting options\n%$$%\n%$$%####Stacking Compatibility:\n%$$%The stacking mechanism requires careful consideration of wall mounting %$$%types.\n%$$%Bins using \""plain\"" wall mounts can stack on bins with other mount types.\n%$$%Note: Using the \""outside\"" dimension option is generally not compatible %$$%with stacking.\n%$$%\n%$$%####Assembly Notes:\n%$$%1. The generator produces three pieces with angled finger joints.\n%$$%Bottom panel, sloped front panel and label panel (if enabled).\n%$$%2. Joint lengths vary to accommodate the slope angles\n%$$%3. Orient pieces as shown in the generated layout to assemble correctly.\n",
You are supposed to add holes or slots to the stair tops yourself using %$$%Inkscape or another vector drawing or CAD program.\n%$$%\n%$$%sh gives height of the stairs from front to back. Note that the overall %$$%width and height is bigger than the nominal values as walls and the %$$%protrusions are not included in the measurements.\n,
"\n%$$%With the \""flanged_ubeam\"" option, there is a fourth piece the length of %$$%\""y\"".\n%$$%![U-Beam with flange](static/samples/ZBeam-flanged-ubeam.jpg)\n",
There is no image yet. Please donate an image of your project on <a %$$%href=&quot;https://github.com/florianfesti/boxes/issues/628&quot; %$$%target=&quot;_blank&quot; rel=&quot;noopener&quot;>GitHub</a>!,
"\n%$$%        <a href=\""https://hackaday.io/project/10649-boxespy\"">Boxes.py</a> %$$%is an <a href=\""https://www.gnu.org/licenses/gpl-3.0.en.html\"">Open Source</%$$%a> box generator written in <a href=\""https://www.python.org/\"">Python</a>. %$$%It features both finished parametrized generators as well as a Python API %$$%for writing your own. It features finger and (flat) dovetail joints, flex %$$%cuts, holes and slots for screws, hinges, gears, pulleys and much more.",
