msgid,msgstr
"\n%$$%<script type=\""module\"" src=\""https://md-block.verou.me/md-block.js\""></%$$%script>\n%$$%<md-block>\n%$$%\n%$$%\n%$$%This will help you create font (and side and top) panels for your\n%$$%boxes that are pre-configured for all the bits and bobs you'd like to\n%$$%install\n%$$%\n%$$%    The layout can create several types of holes including rectangles,\n%$$%    circles and mounting holes.  The default shows an example layout with %$$%all\n%$$%    currently supported objects.\n%$$%\n%$$%####\n%$$%`rect x y w h [cr=0] [cx=True] [cy=True]`\n%$$%\n%$$%     x: x position\n%$$%     y: y position\n%$$%     w: width\n%$$%     h: height\n%$$%    cr: optional, Corner radius, default=0\n%$$%    cx: optional, Center x.  the x position denotes the center of the %$$%rectangle.\n%$$%        accepts t, T, 1, or other true-like values.\n%$$%    cy: optional, Center y.  the y position denotes the center of the %$$%rectangle.\n%$$%\n%$$%#### outline\n%$$%`rect w h`\n%$$%\n%$$%    w: width\n%$$%    h: height\n%$$%\n%$$%`outline` has a special meaning: You can create multiple panel outlines with %$$%one command.\n%$$%This has the effect of making it easy to manage all the holes on all the %$$%sides of\n%$$%your boxes.\n%$$%\n%$$%#### circle\n%$$%`circle x y r`\n%$$%\n%$$%    x: x position\n%$$%    y: y position\n%$$%    r: radius\n%$$%\n%$$%#### mountinghole\n%$$%mountinghole x y d_shaft [d_head=0] [angle=0]\n%$$%\n%$$%          x: x position\n%$$%          y: y position\n%$$%    d_shaft: diameter of the shaft part of the mounting hole\n%$$%     d_head: optional. diameter of the head\n%$$%      angle: optional. angle of the mounting hole\n%$$%\n%$$%#### text\n%$$%`text x y size \""some text\"" [angle=0] [align=bottom|left]`\n%$$%\n%$$%        x: x position\n%$$%        y: y position\n%$$%     size: size, in mm\n%$$%     text: text to render.  This *must* be in quotation marks\n%$$%    angle: angle (in degrees)\n%$$%    align: string with combinations of (top|middle|bottom) and (left|center|%$$%right),\n%$$%           separated by '|'.  Default is 'bottom|left'\n%$$%\n%$$%\n%$$%\n%$$%#### nema\n%$$%`nema x y size [screwhole_size=0]`\n%$$%\n%$$%        x: x position (center of shaft)\n%$$%        y: y position (center of shaft)\n%$$%     size: nema size.  One of [8, 11, 14, 16, 17, 23, 24, 34, 42]\n%$$%    screw: screw size, in mm.  Optional.  Default=0, which means the default %$$%size\n%$$%</md-block>\n%$$%    ",
"This is a configurable gridfinity base.  This\n%$$%    design is based on\n%$$%    <a href=\""https://www.youtube.com/watch?app=desktop&v=ra_9zU-mnl8\"">Zach %$$%Freedman's Gridfinity system</a>",
Extra margin around the gridfinity base to allow it to drop into the carrier %$$%(mm),
"\n%$$%This is a general purpose gridfinity tray generator.  You can create\n%$$%somewhat arbitrarily shaped trays, or just do nothing for simple grid\n%$$%shaped trays.\n%$$%\n%$$%The dimensions are automatically calculated to fit perfectly into a\n%$$%gridfinity grid (like the GridfinityBase, or any other Gridfinity\n%$$%based base).\n%$$%\n%$$%Edit the layout text graphics to adjust your tray.\n%$$%You can replace the hyphens and vertical bars representing the walls\n%$$%with a space character to remove the walls.  You can replace the space\n%$$%characters representing the floor by a \""X\"" to remove the floor for\n%$$%this compartment.\n",
inner height of inner walls in mm (leave to zero for same as outer walls %$$%with optional reduction for stacking),
You need to add a hole pattern to all horizontal layers except the very %$$%bottom,
"This is a two step process. This is step 2.\n%$$%Edit the layout text graphics to adjust your tray.\n%$$%Put in the sizes for each column and row. You can replace the hyphens and\n%$$%vertical bars representing the walls with a space character to remove the %$$%walls.\n%$$%You can replace the space characters representing the floor by a \""X\"" to %$$%remove the floor for this compartment.\n",
"Configurable half of a box which can be: a bookend, a hanging shelf, an %$$%angle clamping jig, ...",
This can be used to create:\n%$$%\n%$$%* a hanging shelf:\n%$$%![HalfBox as hanging shelf](static/samples/HalfBox_Shelf_usage.jpg)\n%$$%\n%$$%* an angle clamping jig:\n%$$%![HalfBox as an angle clamping jig](static/samples/%$$%HalfBox_AngleJig_usage.jpg)\n%$$%\n%$$%* a bookend:\n%$$%![HalfBox as a bookend](static/samples/HalfBox_Bookend_usage.jpg)\n%$$%\n%$$%and many more...\n%$$%\n,
Needs (metal) pins as hinge axles. Pieces of nails will\n%$$%do fine. They need to be cut to length as they are captured as soon as the\n%$$%hinges are assembled.\n%$$%\n%$$%Assemble the box and the lid separately. Then insert the axle into the %$$%hinges.\n%$$%Then attach the hinges on the inside of the box and then connect them to %$$%lid.\n,
A case that can be used in any hobby involving small pieces in need of %$$%organizing.,
"\n%$$%The hobby case is defined by units, \""cells\"" of the case.\n%$$%You define depth, height and widths of the cells.\n%$$%By combining dimensions with number of columns and rows slots for shelves %$$%are generated.\n%$$%Slots can be populated by:\n%$$%\n%$$%* shelves (horizontal piece of plywood that covers full width and depth of %$$%the column. You can put anything on them, but they also provide some %$$%structural integrity. It is recommended to have a least one shelve every 2-4 %$$%slots (depending on the unit height)\n%$$%* rails (3 horizontal pieces that stick out of the side and back walls of %$$%the column. They can be used to allow taller things placed on shelves below, %$$%but also some sliding drawers can be put in them.\n",
Create pieces larger than your laser cutter by joining them with Dove Tails,
This can be used to just create a big panel in a smaller laser cutter. But %$$%the actual use is to split large parts into multiple smaller pieces. Copy %$$%the outline onto the sheet and then use the pieces to cut it into multiple %$$%parts that each can fit your laser cutter. Note that each piece must be cut %$$%with the sheet surrounding it to ensure the burn correction (aka kerf) is %$$%correct. Depending on your vector graphics software you may need to %$$%duplicate your part multiple times and then generate the intersection %$$%between one copy and each rectangular part.\n%$$%\n%$$%The Boxes.py drawings assume that the laser is cutting in the center of the %$$%line and the width of the line represents the material that is cut away. %$$%Make sure your changes work the same way and you do not cutting away the %$$%kerf.\n%$$%\n%$$%Small dove tails make it easier to fit parts in without problems. Lookout %$$%for pieces cut loose where the dove tails meet the edge of the parts. Move %$$%your part if necessary to avoid dove tails or details of your part colliding %$$%in a weird way.\n%$$%\n%$$%For plywood this method works well with a very stiff press fit. Aim for %$$%needing a hammer to join the pieces together. This way they will feel like %$$%they have been welder together.\n%$$%\n,
"\n%$$%    This is a kamishibai butai (japanese image theatre), with several %$$%options for covering the different\n%$$%    holes when put away.\n%$$%    Magenta cuts should be performed before the blue cuts.\n%$$%    The recommended wood thickness is 5 mm at least, particularly if you go %$$%for big sizes (which works\n%$$%    fine with A4 or A3). If you use 3 mm, you should not use the screwing %$$%option (disabled by default),\n%$$%    so you can assemble your box with glue or force the pieces together %$$%(using a bigger burn parameter).\n%$$%    Please note that using the screwing option often means adding feet %$$%(which can be 3D printed for\n%$$%    example). It makes the box easier to mount and unmount for repairing %$$%purposes, and the feet protect\n%$$%    the wood from whatever surface the box is put on. Screws are not %$$%compatible with a small frame\n%$$%    thickness (i.e. with sheets with a small margin).\n%$$%    For assembling the box, please follow the following steps:\n%$$%    1. Assemble the front side and back side pieces to the front and back of %$$%the front and back panels\n%$$%    respectively\n%$$%    2. Assemble the top handle pieces together and insert two of the plates %$$%into the two holes (centered);\n%$$%    then insert the assembled handles into the dansle ceiling and add the %$$%two other plates\n%$$%    3. Insert the front and back panels into the bottom panel\n%$$%    4. Attach the handle between the top of the front and back panels, then %$$%add the top panel but do not\n%$$%    fasten it yet, just keep it loose on top\n%$$%    5. Assemble the locks together to the doors if enabled:\n%$$%       5.1 lock with key : lock front - lock external - plate cut from the %$$%door (also add the door now) -\n%$$%       lock internal\n%$$%       5.2 lock simple : lock grip - lock external - plate cut from the door %$$%(also add the door now) -\n%$$%       lock internal\n%$$%       5.3 small extra locks for top and bottom : lock grip - plate cut from %$$%the door (also add the door\n%$$%       now) - lock internal - lock spacer - lock locker\n%$$%    6. Add the hinges to the doors if needed (for two-panes front doors)\n%$$%    7. fasten the top\n%$$%    8. Attach two side panel inner plates to a side panel with the two pegs %$$%(use glue if necessary) and\n%$$%    repeat a second time\n%$$%    9. If you use a lock with key, add the last short peg to the back plate %$$%(you may want to sand it a bit\n%$$%    on the other half so that the key can be attached easily enough, but it %$$%should not fal off either)\n%$$%    10. You should now be able to close and open all the doors\n%$$%    Usage recommendations:\n%$$%    1. Add your paper sheets fron one side or the other (normally you leave %$$%either left or right closed,\n%$$%    depending on which is more comfortable for you)\n%$$%    2. Thick paper is easier to handle ; if you print on a home printer, use %$$%the thickest you printer can\n%$$%    print (probably around 200 grams per square meter) ; if you want extra %$$%quality, go to a printing shop\n%$$%    and ask them for 300 grams per square meter printing\n%$$%    3. You can also buy virgin drawing paper to write your own stories\n%$$%    4. If you decided to go for the lock with key, you can ask one of the %$$%participants to unlock the box,\n%$$%    it really helps in immersing into toe story\n%$$%    5. If you need a kamishibai for showing images during a guided tour, you %$$%may choose to use the\n%$$%    one-panel front, and use transparent acrylic for the back and front %$$%panels to keep you sheets\n%$$%    protected from light rain ; you may need to cut the box from a rain-%$$%resistant material\n%$$%    (outside-compatible plywood or acrylic)\n%$$%    ",
Thickness of the top handle in multiples of thickness (Set to 0 for no %$$%handle),
Width of the top handle in mm (Set to 0 for no handle) ; the SheetStackDepth %$$%should be at least 4 x thickness more,
"Back extra depth (for adding buttons for example), in multiples of %$$%thickness ; set to 0 to let the system calculate the smallest one",
"Margin for the pegs width in mm ; set to a lower value if the pieces are %$$%forced together, a higher value if the pieces slide easily into eachother %$$%(using screws or glue to assemble)",
"Front extra depth (for attaching hinges for example), in multiples of %$$%thickness ; set to 0 to ignore or let the system calculate the smallest one",
separation of the cover holes from one another's center in mm (section %$$%parameter type) ; the first item is the distance from the border,
separation of the box holes from one another's center in mm (section %$$%parameter type) ; the first item is the distance from the border,
Distance of the screw axis from the side border (in multiples of thickness),
"Diameter of the screw holes for extra feet at the corners, in mm (set to 0 %$$%for no screws)",
"Distance from the border for the axis of the extra feet at the corners, in %$$%mm (set to 0 for no screws)",
Example for a KeyHolder with a slightly larger backplate and 8 hooks. This %$$%uses 6mm plywood for extra stability.\n%$$%\n%$$%Closeup:\n%$$%\n%$$%![KeyHolder-2](static/samples/KeyHolder-2.jpg)\n%$$%\n%$$%Full picture:\n,
Note that top layers use a different material thickness according to the %$$%top1_thickness and top2_thickness (if enabled).,
"thickness of the button hold layer, cherry like switches need 1.5mm or %$$%smaller to snap in",
"thickness of the hotplug layer, CPG151101S11 hotswap sockets need 1.2mm to %$$%1.5mm",
desired height between bottom of laptop and ground at lowest point (front of %$$%laptop stand),
You need a tension spring of the proper length to make the clamp work.\n%$$%Increase extraheight to get more space for the spring and to make the\n%$$%sliding mechanism less likely to bind. You may need to add some wax on the\n%$$%parts sliding on each other to reduce friction.\n,
Bench power supply powered with Maktia 18V battery or laptop power supply,
"\n%$$%Vitamins: DSP5005 (or similar) power supply, two banana sockets, two 4.8mm %$$%flat terminals with flat soldering tag\n%$$%\n%$$%To allow powering by laptop power supply: flip switch, Lenovo round socket %$$%(or adjust right  hole for different socket)\n",
diameter of the flipswitch mounting hole (disabled of no secondary power),
"## Simple WS2812b matrix enclosure\n%$$%    WS2812b matrix enclosure for cheap chinease prebuild led matrixes.\n%$$%    This design assumes that the distance between the leds is equal in both %$$%directions.\n%$$%\n%$$%    There are several parts to this design:\n%$$%    - The inner frame to hold the pcb in place\n%$$%    - The front frame to hold a sandwich of plexiglass, spacer and the pcb\n%$$%    - The plexiglass to protect and diffuse the leds.\n%$$%        You may add car tint foil to the plexiglass to achieve a black look\n%$$%    - The spacer to keep the plexiglass from touching the leds\n%$$%    - The back box with an optional mounting hole. Please add a hole for %$$%the\n%$$%        power supply to the side panels and the power and data cables\n%$$%        through the led mount frame with your favorite svg editor.\n%$$%    - The side panels with finger joints to hold everything together\n%$$%\n%$$%    Assembly:\n%$$%    1. Cut the parts\n%$$%    2. Assemble the frame (side panels and inner frame)\n%$$%    3. Insert the pcb, the spacers and the plexiglass\n%$$%    4. Close the front frame\n%$$%    5. Insert electronics in the back box\n%$$%        (for example a USB C port on the side panel, a esp32 with wled %$$%firmware)\n%$$%    6. Close the back box\n%$$%\n%$$%    The inner frame and spacer should keep everything in place without the %$$%need for glue.\n%$$%    If you are using multiple modules,\n%$$%    you can add the layout parameters, so that the inner frame adjusts %$$%accordingly.\n%$$%\n%$$%    Please Note: if you are creating a large matrix build of multiple %$$%individual modules,\n%$$%    you need to enter absolute values across all modules for all %$$%parameters.\n%$$%    Please cut the plane labeled \""Plexiglass\"" out of plexiglass :)\n%$$%    You can use a different thickness for the plexiglass, but make sure to %$$%adjust the settings accordingly.\n%$$%    ",
Border of the back frame bo keep the pcb in blace but allow for air flow and %$$%cable management,
Distance of the color dividers. Make sure your machine is able to cut thin %$$%structures.,
"adds an additional vertical segment to hold the switch in place, works best %$$%w/ --stable",
This is a simple light box with a closed compartment for electronics and the %$$%backlighting.,
Night lightbox diffuser plate lock to prevent unwanted access to the %$$%electronics,
Diameter of the background acrylic diffuser plate locking screw hole in mm,
"Night lightbox options for the back side (holes for connectors, marking)",
"extra holes for connectors or buttons ; enter one line per hole ; first %$$%parameter chould be R for rectangle or C for circle ; then X and Y position %$$%for the center of the hole, and then the X and Y size of the rectangle or %$$%the circle diameter, all in mm ; parameters should be separated by spaces",
If the feet of the `Stackable` `bottom_edge`\n%$$%don't fit on the front (and back) walls you can make them smaller by\n%$$%reducing `width` and/or increasing `angle` in the `Settings for\n%$$%Stackable Edges`. Reducing the `opening` will also give more space for\n%$$%the feet.,
mouth to circumference ratio (0.1 to 0.45). Determines the width to depth %$$%ratio,
"\n%$$%Box made of paper, with lid.\n",
"\n%$$%This box is made of paper.\n%$$%\n%$$%There is marks in the \""outside leftover paper\"" to help see where to fold\n%$$%(cutting with tabs helps use them). The cut is very precise, and could be %$$%too tight if misaligned when glued. A plywood box (such as a simple %$$%TypeTray) of the same size is a great guide during folding and gluing. Just %$$%fold the box against it. Accurate quick and easy.\n%$$%\n%$$%A paper creaser (or bone folder) is also useful.\n",
different design for paper consumption optimization. The tuckbox also has %$$%locking cut for its lid.,
\n%$$%Smartphone desk holder\n,
"\n%$$%    This phone stand holds your phone between two tabs, with access to its\n%$$%    bottom, in order to connect a charger, headphones, and also not to %$$%obstruct\n%$$%    the mic.\n%$$%\n%$$%    Default values are currently based on Galaxy S7.\n",
"Depth of the phone. Used by the bottom support holding the phone, and the %$$%side tabs depth as well. Should be at least your material thickness for %$$%assembly reasons.",
"Spacing between the two bottom support. Choose a value big enough for the %$$%charging cable, without getting in the way of other ports.",
\n%$$%3-layer photo frame with a slot at the top to slide matboard/acrylic/glass %$$%over the photo after glue-up.\n,
"\n%$$%3-layer photo frame.\n%$$%\n%$$%Selected excellent features:\n%$$%\n%$$%* easy to change the photo after glue-up, without disassembling the frame\n%$$%* calculates the ideal matting size for your photo based on ancient Greek %$$%mathematics\n%$$%* can make the frame in one piece or split into 4 pieces to save material\n%$$%* can make a frame to fit the piece of glass/acrylic you already have\n%$$%* adds a hole for hanging the frame on the wall\n%$$%\n%$$%Features available in the mysterious future:\n%$$%\n%$$%* rounded corners\n%$$%* a stand on the back to display the frame on a table\n%$$%\n%$$%## How to frame things like a pro\n%$$%\n%$$%There are 1 or 2 things that you can't change when framing: the size of the %$$%artwork\n%$$%and the size of the glass. So we generate everything else to fit those %$$%measurements.\n%$$%\n%$$%Set `x` and `y` to the dimensions of the actual artwork.\n%$$%\n%$$%* If your photo has a border, measure inside it.\n%$$%* If your photo does not have a border, still measure the actual artwork. %$$%Don't reduce the dimensions to allow for mounting. We do that separately.\n%$$%\n%$$%A real pro measures the photo, calculates the matting, and cuts the glass to %$$%fit the matting.\n%$$%We will assume that you are not in fact a real pro, and can't be trusted %$$%with a glass cutter.\n%$$%So measure your glass and we'll calculate the matting to suit it. If you %$$%aren't using glass,\n%$$%we'll calculate the matting size based on \""golden ratio of areas\"" like the %$$%pros do. Everyone\n%$$%will think your frame is perfect, but they won't know why.\n%$$%\n%$$%Matting is just cardboard. Its jobs are to keep the glass off the photo, %$$%provide a clean border around the artwork,\n%$$%and make the whole thing look fancy. You can attach the photo to the matting %$$%or to the back of the frame.\n%$$%Either way, the matting conceals all sorts of sins like bad cuts, glue %$$%marks, or mounting with blue painter's tape.\n%$$%Matting also lets you reuse the frame for different sized photos. Just %$$%generate a new mat with the same glass dimensions.\n%$$%\n%$$%The hole in the matting is smaller than the photo. This is so the photo %$$%doesn't fall out.\n%$$%Even if your photo has a border, the hole needs to be a bit smaller than the %$$%photo,\n%$$%or you will struggle to line up the photo without the edges showing.\n%$$%Recommended overlaps are given in the settings. Don't worry about \""losing\"" %$$%too much of the photo.\n%$$%The matting will make the photo look bigger and more important. There's %$$%never anything\n%$$%interesting in the last 2mm of a photo anyway.\n",
"Do not assemble sides before attaching the lid!\n%$$%    Hinge of the lid has to be placed first because it is impossible\n%$$%    to get it in position without removing the side wall. The lid can\n%$$%    be a bit tricky to assemble. Keep track of how the parts fit together.\n%$$%    Part with label \""lid back\"" is placed in the hinges",
\n%$$%You need (permanent) baking paper to create the conveyor. With that you can %$$%pick up and put down the pizza by moving the handle attached to the belt.\n%$$%    ,
Diameter of the screw holes in the bottom of the pusher - where the screws %$$%pass through,
Diameter of the screw holes in the bottom of the pusher - where the screws %$$%hold,
Still has issues. The middle planetary gears set must not have a mashing sun %$$%gear as it can't be a proper gear set.,
"mounting patterns: x=xlr, m=midi, p=9v-power, w=6.5mm-wire, space=next row",
"For short side walls that don't fit a connecting finger reduce %$$%*surroundingspaces* and *finger* in the Finger Joint Settings.\n%$$%\n%$$%The lids needs to be glued. For the bayonet lid all outside rings attach to %$$%the bottom, all inside rings to the top.\n",
\n%$$%Default: edge_style = f Finger Joint:\n%$$%![Finger Joint](static/samples/RoundedBox-2.jpg)\n%$$%\n%$$%Alternative: edge_style = h Edge (parallel Finger Joint Holes):\n%$$%![Finger Joint Holes](static/samples/RoundedBox-3.jpg)\n%$$%\n%$$%With lid:\n,
\n%$$%![Lids off](static/samples/RoundedRegularBox2.jpg)\n,
Most of the blue lines need to be engraved by cutting with high speed and %$$%low power. But there are three blue holes that actually need to be cut: The %$$%grip hole in the lid and two tiny rectangles on the top and bottom for the %$$%lid to grip into.\n%$$%\n%$$%![Lid Details](static/samples/RoyalGame-2.jpg)\n%$$%\n%$$%![All pieces](static/samples/RoyalGame-3.jpg)\n%$$%\n,
This pattern is indented to be used with a LED stripe that is wound through %$$%all segments in an S pattern while the stripe being upright on its side. It %$$%can also be used with small pieces of LED stripes connected with short wires %$$%for large enough sizes.\n,
You need a LED stripe that is wound through all segments in an S pattern and %$$%then continuing to the next digit while the stripe being upright on its %$$%side. Selecting *debug* gives a better idea how things fit together.\n%$$%\n%$$%Adding a diffuser on top or at the bottom of the segment holes will probably %$$%enhance the visuals. Just using paper may be enough.\n%$$%\n%$$%There is currently not a lot of space for electronics and this generator is %$$%still untested. Good luck!\n,
\n%$$%The frame needed to build a shadowbox from paper cutouts.\n%$$%The cutout used in the photographs can be downloaded [here](https://3axis.co/%$$%laser-cut-my-neighbor-totoro-3d-lightbox-lamp-cdr-file/eoxldrxo/).\n%$$%\n%$$%See the diagram below for dimensions.\n%$$%\n%$$%![diagram](static/samples/Shadowbox-diagram.jpg)\n%$$%\n%$$%![backlit](static/samples/Shadowbox-backlit.jpg)\n,
"cumulative height of your paper layers, play between frames, the LED strip, %$$%battery/wiring, anything else you want to fit in the case",
whether or not to join sides to front plate (disable if doing manual joins %$$%on fancy wood),
Shoe shaped box with flat sides and rounded top.\n%$$%    Works best if flex if under slight compression.\n%$$%    Make sure that the following conditions are met:\n%$$%    y > tophole + r + fronttop;\n%$$%    height > frontheight.,
Beware of the rolling shutter effect! Use wax on sliding surfaces.\n%$$%\n%$$%![Inside](static/samples/ShutterBox-3.jpg)\n%$$%\n%$$%![Detail](static/samples/ShutterBox-2.jpg)\n,
Box with service hatches on either one or both of the sides that are locked %$$%with latches,
"\n%$$%This box is designed as a housing for electronic projects but could be used %$$%for other purposes. It has hatches that can be re-opened with simple tools. %$$%If built from thin enough material, it intentionally cannot be opened with %$$%bare hands.\n%$$%\n%$$%The hatches are on the x sides.\n%$$%\n%$$%#### Assembly instructions\n%$$%The main body is easy to assemble:\n%$$%1. Starting with the floor and then add the four walls (for any removable %$$%sides, the wall will just be a small part on the base )\n%$$%2. Add the top piece\n%$$%\n%$$%For the removable walls:\n%$$%1. Add the lips to the removable walls\n%$$%2. Sit the latches in place (it is importand to make sure the springs on the %$$%latches point inwards and the angled ends point to the side walls. See image %$$%below)\n%$$%3. Glue the U-shaped clamps in place (it is important **not** to glue the %$$%latches)\n%$$%\n%$$%![Wall details](static/samples/SideDoorHousing.jpg)\n%$$%\n%$$%\n%$$%#### Re-Opening\n%$$%\n%$$%The latches lock in place when closed. To open them they need to be pressed %$$%in and can then be moved aside.\n%$$%\n%$$%![Closed Box](static/samples/SideDoorHousing-2.jpg)\n%$$%\n",
"Box, with an hinge that does not protrude from the back of the box, and a %$$%latch.",
