msgid,msgstr
inner height of inner walls in mm (unless outside selected)(leave to zero %$$%for same as outer walls),
sections left to right in mm [🛈](https://florianfesti.github.io/boxes/html/%$$%usermanual.html#section-parameters),
sections back to front in mm [🛈](https://florianfesti.github.io/boxes/html/%$$%usermanual.html#section-parameters),
sections bottom to top in mm [🛈](https://florianfesti.github.io/boxes/html/%$$%usermanual.html#section-parameters),
treat sizes as outside measurements [🛈](https://florianfesti.github.io/boxes/%$$%html/usermanual.html#outside),
thickness of the material (in mm) [🛈](https://florianfesti.github.io/boxes/%$$%html/usermanual.html#thickness),
format of resulting file [🛈](https://florianfesti.github.io/boxes/html/%$$%usermanual.html#format),
width of tabs holding the parts in place (in mm)(not supported everywhere) %$$%[🛈](https://florianfesti.github.io/boxes/html/usermanual.html#tabs),
print surrounding boxes for some structures [🛈](https://%$$%florianfesti.github.io/boxes/html/usermanual.html#debug),
print reference rectangle with given length (in mm)(zero to disable) [🛈]%$$%(https://florianfesti.github.io/boxes/html/usermanual.html#reference),
style for inner corners [🛈](https://florianfesti.github.io/boxes/html/%$$%usermanual.html#inner-corners),
burn correction (in mm)(bigger values for tighter fit) [🛈](https://%$$%florianfesti.github.io/boxes/html/usermanual.html#burn),
height of the bottom lips sticking out  (multiples of thickness) %$$%FingerHoleEdge only!,
height of strips to be glued to the inside of bottom edges (multiples of %$$%thickness),
This box is kept simple on purpose. If you need more features have a look at %$$%the UniversalBox.,
"\n%$$%Agricola Revised Edition game box insert, including some expansions.\n",
"\n%$$%This insert was designed with 3 mm plywood in mind, and should work fine %$$%with\n%$$%materials around this thickness.\n%$$%\n%$$%This is an insert for the [Agricola Revised Edition](https://%$$%boardgamegeek.com/boardgame/200680/agricola-revised-edition)\n%$$%board game. It is specifically designed around the [Farmers Of The Moor %$$%expansion](https://boardgamegeek.com/boardgameexpansion/257344/agricola-%$$%farmers-moor),\n%$$%and should also store the [5-6 players expansion](https://boardgamegeek.com/%$$%boardgameexpansion/210625/agricola-expansion-5-and-6-players)\n%$$%(not tested, but I tried to take everything into account for it, please %$$%inform\n%$$%us if you tested it).\n%$$%\n%$$%It can be stored inside the original game box, including the 2 expansions,\n%$$%with the lid slightly raised.\n%$$%\n%$$%The parts of a given element are mostly generated next to each other %$$%vertically.\n%$$%It should be straightforward to match them.\n%$$%\n%$$%Here are the different elements, from left to right in the generated file.\n%$$%\n%$$%#### Card tray\n%$$%\n%$$%The cards are all kept in a tray, with paper dividers to sort them easily. %$$%When\n%$$%the tray is not full of cards, wood dividers slides in slots in order to %$$%keep\n%$$%the cards from falling into the empty space.\n%$$%\n%$$%There should be enough space for the main game, Farmers Of The Moor, and the %$$%5-6\n%$$%player expansion, but not much more than that.\n%$$%\n%$$%To keep a lower profile, the cards are at a slight angle, and the paper %$$%dividers\n%$$%tabs are horizontal instead of vertical.\n%$$%A small wall keeps the card against one side while the tabs protrude on the\n%$$%other side, above the small wall.\n%$$%\n%$$%The wall with the big hole is the sloped one. It goes between the two\n%$$%\""comb-like\"" walls first, with its two small holes at the bottom. Then %$$%there is a\n%$$%low-height long wall with a sloped edge which should go from the sloped wall %$$%to\n%$$%the other side. You can finish the tray with the last wall at the end.\n%$$%\n%$$%#### Upper level trays\n%$$%\n%$$%4 trays with movable walls are used to store resources. They were designed %$$%to\n%$$%store them in this order:\n%$$%\n%$$%* Stone / Vegetable / Pig / Cow\n%$$%* Reed / Grain / Sheep\n%$$%* Wood / Clay\n%$$%* Food / Fire\n%$$%\n%$$%The wall would probably be better if fixed instead of movable, but I would %$$%like\n%$$%to test with the 5-6 player expansion to be sure their positions are %$$%correct\n%$$%with it too.\n%$$%\n%$$%The little feet of the movable wall should be glued. The triangles are put\n%$$%horizontally, with their bases towards the sides.\n%$$%\n%$$%#### Lower level tray\n%$$%\n%$$%The lower level tray is used to store the horses.\n%$$%\n%$$%#### Room/Field tiles\n%$$%\n%$$%Two boxes are generated to store the room/field tiles. One for the wood/%$$%field,\n%$$%the other for the clay/stone. They are stored with the main opening upside, %$$%but\n%$$%I prefer to use them during play with this face on the side.\n%$$%\n%$$%#### Moor/Forest and miscellaneous tiles\n%$$%\n%$$%A box is generated to store the Moor/Forest tiles, and some other tiles such %$$%as\n%$$%the \""multiple resources\"" cardboard tokens.\n%$$%\n%$$%The Moor/Forest tiles are at the same height as the Room/Field, and the %$$%upper\n%$$%level trays are directly on them. The horse box and player box are slightly\n%$$%lower. This Moor/Forest box have a lowered corner (the one for the %$$%miscellaneous\n%$$%tiles). Two cardboard pieces can be stored between the smaller boxes and %$$%the\n%$$%upper level trays (as seen on the picture).\n%$$%\n%$$%Be sure to match the pieces so that the walls with smaller heights are next %$$%to\n%$$%each other.\n%$$%\n%$$%#### Players bit boxes\n%$$%\n%$$%Each player has its own box where the bits of his color are stored.\n%$$%The cardboard bed from Farmers Of The Moor is central to this box.\n%$$%\n%$$%* The fences are stored inside the bed\n%$$%* The bed is placed in the box, with holes to keep it there (and to take %$$%less\n%$$%  height)\n%$$%* The stables are stored in the two corners\n%$$%* The five farmers are stored between the bed and the three walls, %$$%alternatively\n%$$%  head up and head down.\n%$$%\n%$$%During assembly, the small bars are put in the middle holes. The two bigger\n%$$%holes at the ends are used for the bed feet. The bar keeps the bed from\n%$$%protruding underneath.\n%$$%\n",
See [Nukit Open Air Purifier](https://github.com/opennukit/Nukit-Open-Air-%$$%Purifier/)\n,
how far the dove tails stick out of/into the edge (multiples of thickness),
height of hole(s) in percentage of maximum hole height (handle height - 2 * %$$%material thickness),
width of hole(s) in percentage of maximum hole width (width of edge - (n+1) %$$%* material thickness),
"added to side panels if checked, to front and back otherwise (only used with %$$%top_edge parameter)",
"Shape of the plate cutout: 'castle' allows for modding, and 'simple' is a %$$%tighter and simpler square",
"Each column is separated by '/', and is in the form 'nb_rows @ offset x %$$%repeat_count'. Nb_rows is the number of rows for this column. The offset is %$$%in mm and optional. Repeat_count is optional and repeats this column %$$%multiple times. Spaces are not important.For example '3x2 / 4@11' means we %$$%want 3 columns, the two first with 3 rows without offset, and the last with %$$%4 rows starting at 11mm high.",
"This box is more of a building block than a finished item.\n%$$%Use a vector graphics program (like Inkscape) to add holes or adjust the %$$%base\n%$$%plate. The width of the \""brim\"" can also be adjusted with the %$$%**edge_width**\n%$$% parameter in the **Finger Joints Settings**.\n%$$%\n%$$%See ClosedBox for variant without a base.\n",
"Glue together - all outside rings to the bottom, all inside rings to the top.",
mounting hole diameter (shaft:head) in mm [🛈](https://florianfesti.github.io/%$$%boxes/html/usermanual.html#mounting-holes),
"Angled display stand for books, ring files, flyers, postcards, or business %$$%cards.",
"\n%$$%Smaller versions for postcards (with a small ledge) and for business cards:\n%$$%\n%$$%![BookHolder minis (front)](static/samples/BookHolder-minis.jpg)\n%$$%\n%$$%![BookHolder minis (side)](static/samples/BookHolder-minis-side.jpg)\n%$$%\n%$$%BookHolder with default parameters (A4 size, landscape, back_support):\n%$$%\n%$$%![BookHolder (back)](static/samples/BookHolder-back.jpg)\n",
"When rendered with the \""double\"" option the parts with the double slots get %$$%connected the shorter beams in the asymmetrical slots.\n%$$%\n%$$%Without the \""double\"" option the stand is a bit more narrow.\n",
"## Stackable nestable sorting sieve for bricks\n%$$%A stackable sorting sieve for bricks, nestable for storage.\n%$$%You will need to export all 5 levels, to get a full sieve.\n%$$%If you feel you do not need the upper levels, just do not export them.\n%$$%x,y,h are the dimensions for the largest sieve,\n%$$%they will be the outer dimensions of the box,\n%$$%the smaller sieves will be nested inside, therefore smaller.\n%$$%Of course 256mm or 384mm (base plate size) are recommended values for x and %$$%y,\n%$$%but you can use any value you like.\n%$$%\n%$$%Full set of all 5 levels:\n%$$%![Full Set](static/samples/BrickSorter-2.jpg)\n%$$%\n%$$%![Full Set](static/samples/BrickSorter-3.jpg)\n%$$%\n%$$%Stacked for Usage:\n%$$%![Stacked](static/samples/BrickSorter-4.jpg)\n%$$%\n%$$%Nested for Storage:\n%$$%![Full Set](static/samples/BrickSorter-5.jpg)\n%$$%\n%$$%In Use:\n%$$%![Full Set](static/samples/BrickSorter-6.jpg)\n",
Radius of the corners of the sieve pattern in mm. Enter 30 for circular %$$%holes.,
This generator will make shapes that you can use to select\n%$$%optimal value for burn parameter for other generators. After burning try to\n%$$%attach sides with the same value and use best fitting one on real projects.\n%$$%In this generator set burn in the Default Settings to the lowest value\n%$$%to be tested. To get an idea cut a rectangle with known nominal size and\n%$$%measure the shrinkage due to the width of the laser cut. Now you can\n%$$%measure the burn value that you should use in other generators. It is half\n%$$%the difference of the overall size as shrinkage is occurring on both\n%$$%sides. You can use the reference rectangle as it is rendered without burn\n%$$%correction.\n%$$%\n%$$%See also LBeam that can serve as compact BurnTest and FlexTest for testing %$$%flex settings.\n,
\n%$$%for AA batteries:\n%$$%\n%$$%![CanStorage for AA batteries](static/samples/CanStorageAA.jpg)\n%$$%\n%$$%for canned tomatoes:\n,
The filter does not include the top rim. You need some rectangular wooden %$$%strip about 2-3cm in size to glue around. The x and y are without this rim %$$%and should be about 5 cm smaller that the nominal size.\n%$$%\n%$$%The following sizes are currently hard coded:\n%$$%\n%$$%* Height of rails on top: 50mm\n%$$%* Borders on top: 40mm\n%$$%* Char coal width (horizontal): 40mm\n%$$%* Bottom width: 40 + 20 + 40 mm\n%$$%\n%$$%For assembly it is important that all bottom plates are the same way up. %$$%This allows the ribs of adjacent pockets to pass beside each other.\n%$$%\n%$$%There are three type of ribs:\n%$$%\n%$$%* Those with staight tops go in the middle of the bottom plates\n%$$%* Those pointier angle go at the outer sides and meet with the side bars\n%$$%* The less pointy go at all other sides of the bottom plates that will end %$$%up on the inside\n%$$%\n%$$%The last two types of ribs do not have finger joints on the outside but %$$%still need to be glued to the top beam of the adjacent pocket or the left or %$$%right side bar.\n,
"\n%$$%### Description\n%$$%Versatile Box for Storage of playing cards. Multiple different styles of %$$%storage are supported, e.g. a flat storage or a trading card deck box style %$$%storage. See images for ideas.\n%$$%\n%$$%#### Building instructions\n%$$%Place inner walls on floor first (if any). Then add the outer walls. Glue %$$%the two walls without finger joins to the inside of the side walls. Make %$$%sure there is no squeeze out on top, as this is going to form the rail for %$$%the lid.\n%$$%\n%$$%Add the top of the rails to the sides (front open) or to the back and front %$$%(right side open) and the grip rail to the lid.\n%$$%Details of the lid and rails\n%$$%![Details](static/samples/CardBox-detail.jpg)\n%$$%Whole box (early version still missing grip rail on the lid):\n",
Direction in which the lid slides open. Lid length > Lid width recommended.,
minimum space left and right without grooves (fraction of the edge length),
This was done as a table decoration. May be at some point in the future %$$%someone will create a proper castle\n%$$%with towers and gates and walls that can be attached in multiple %$$%configurations.,
This box is more of a building block than a finished item.\n%$$%Use a vector graphics program (like Inkscape) to add holes or adjust the %$$%base\n%$$%plate.\n%$$%\n%$$%See BasedBox for variant with a base.,
\n%$$%Coffee capsule holder\n,
"\n%$$%    You can store your coffee capsule near your espresso machine with this. %$$%It works both vertically, or upside down under a shelf.\n",
"\n%$$%Make sure not to discard the circle cutouts from the lid, base, and door. %$$%They are all needed.\n%$$%\n%$$%![Closed](static/samples/CoinBankSafe-closed.jpg)\n%$$%\n%$$%![Open](static/samples/CoinBankSafe-open.jpg)\n%$$%\n%$$%Assemble the locking pins like this: wiggle-disc, number-disc, doorhole-%$$%disc, spacer-disc, D-disc.\n%$$%Glue the first three in place, but do not glue the last two.\n%$$%Leaving them unglued will allow you change the code, and to remove the pin %$$%from the door.\n%$$%\n%$$%![Pins](static/samples/CoinBankSafe-pins.jpg)\n%$$%\n",
extend the triangle along the length of the edge (multiples of thickness),
minimum space left and right without holes (fraction of the edge length),
Distance in X from edge of tray in mm. Has no effect when text is centered.,
"Sliding lid rests on inner walls,\n%$$%so will not work if no inner walls are present.\n%$$%Suggested to place walls close to both sides for maximum stability.\n%$$%Margin helps to prevent the lid from getting stuck.\n%$$%Vertical margin increases the overall height.\n%$$%The lip holding the lid in place can be generated as two separate\n%$$%pieces or as a single piece that continues at the back.\n%$$%\n%$$%![Closed](static/samples/CompartmentBox-closed.jpg)\n%$$%![Half open](static/samples/CompartmentBox-lid.jpg)\n",
\n%$$%\n%$$%Console Arcade Stick\n%$$%\n%$$%![Front](static/samples/ConsoleArcadeStickFront.jpg)\n%$$%![Back](static/samples/ConsoleArcadeStickBack.jpg)\n%$$%![Inside](static/samples/ConsoleArcadeStickInside.jpg)\n%$$%\n%$$%Keyboard enclosure:\n,
\n%$$%This box is designed as a housing for electronic projects. It has hatches %$$%that can be re-opened with simple tools. It intentionally cannot be opened %$$%with bare hands - if build with thin enough material.\n%$$%\n%$$%#### Caution\n%$$%There is a chance that the latches of the back wall or the back wall itself %$$%interfere with the front panel or its mounting frame/lips. The generator %$$%does not check for this. So depending on the variant chosen you might need %$$%to make the box deeper (increase y parameter) or the panel angle steeper %$$%(increase angle parameter) until there is enough room.\n%$$%\n%$$%It's also possible that the frame of the panel interferes with the floor if %$$%the hi parameter is too small.\n%$$%\n%$$%#### Assembly instructions\n%$$%The main body is easy to assemble by starting with the floor and then adding %$$%the four walls and (if present) the top piece.\n%$$%\n%$$%If the back wall is removable you need to add the lips and latches. The U-%$$%shaped clamps holding the latches in place need to be clued in place without %$$%also gluing the latches themselves. Make sure the springs on the latches %$$%point inwards and the angled ends point to the side walls as shown here:\n%$$%\n%$$%![Back wall details](static/samples/Console2-backwall-detail.jpg)\n%$$%\n%$$%If the panel is removable you need to add the springs with the tabs to the %$$%side lips. This photo shows the variant which has the panel glued to the %$$%frame:\n%$$%\n%$$%![Back wall details](static/samples/Console2-panel-detail.jpg)\n%$$%\n%$$%If space is tight you may consider not gluing the cross pieces in place and %$$%remove them after the glue-up. This may prevent the latches of the back wall %$$%and the panel from interfering with each other.\n%$$%\n%$$%The variant using finger joints only has the two side lips without the cross %$$%bars.\n%$$%\n%$$%#### Re-Opening\n%$$%\n%$$%The latches at the back wall lock in place when closed. To open them they %$$%need to be pressed in and can then be moved aside.\n%$$%\n%$$%To remove the panel you have to press in the four tabs at the side. It is %$$%easiest to push them in and then pull the panel up a little bit so the tabs %$$%stay in.\n,
"Text to be engraved can be generated by inputting the label and fontsize\n%$$%fields. height represents the area that can be used for writing text,\n%$$%does not match the actual height when standing. Generated text is put\n%$$%in the center and can be adjusted using the vertical text offset.\n%$$%Empty lines will affect the placement.",
mirrors one of the stand so the same side of the material can be placed on %$$%the outside,
Feel free to add a shallow ABox as a container for catching the dice so they %$$%don't scatter across the table.\n%$$%\n%$$%You can also configure the DiceTower and change the number and angle of the %$$%ramps.\n,
Set *bottomheight* to 0 for a wall mounting variant.\n%$$%Please add mounting holes yourself.,
Fully closed box intended to be cut from transparent acrylics and to serve %$$%as a display case.,
\n%$$%Adding '0:' at the start of the sy parameter adds a slot at the very back. %$$%Adding ':0' at the end of sy adds a slot meeting the bottom at the very %$$%front. This is especially useful if slot angle is set above zero.\n%$$%\n%$$%There are 4 different sets of dividers rendered:\n%$$%\n%$$%* With asymmetric tabs so the tabs fit on top of each other\n%$$%* With tabs of half wall thickness that can go side by side\n%$$%* With tabs of a full wall thickness\n%$$%* One single divider spanning across all columns\n%$$%\n%$$%You will likely need to cut each of the dividers you want multiple times.\n,
extra slack (in addition to thickness and kerf) to help insert dividers in mm,
Note: `sh` gives the height of the rows front to back. It though should have %$$%the same number of entries as `sy`. These heights are the one on the left %$$%side and increase throughout the row. To have each compartment a bit higher %$$%than the previous one the steps in `sh` should be a bit bigger than %$$%`extra_height`.\n%$$%\n%$$%Assembly:\n%$$%\n%$$%![Parts](static/samples/DrillStand-drawing.png)\n%$$%\n%$$%Start with putting the slots of the inner walls together. Be especially %$$%careful with adding the bottom. It is always asymmetrical and flush with the %$$%right/lower side while being a little short on the left/higher side to not %$$%protrude into the side wall.\n%$$%\n%$$%|      |      |\n%$$%| ---- | ---- |\n%$$%| ![Assembly inner walls](static/samples/DrillStand-assembly-1.jpg) | !%$$%[Assembly bottom](static/samples/DrillStand-assembly-2.jpg) |\n%$$%| Then add the front and the back wall. | Add the very left and right walls %$$%last. |\n%$$%| ![Assembly front and back](static/samples/DrillStand-assembly-3.jpg) | !%$$%[Assembly side walls](static/samples/DrillStand-assembly-4.jpg) |\n,
"\n%$$%### Description\n%$$%Fat balls are quite common to feed tits. Here you can build a dispenser that %$$%protects\n%$$%the fat balls from rain and snow. The design was tested using 4mm plywood %$$%for the\n%$$%main structural parts. For the spacer of the locking mechanism two layers of %$$%3mm\n%$$%plywood have been stacked. The poles were made from 8mm diameter beech rod %$$%and 19cm\n%$$%in length. Some basic consistency checks have been made for different %$$%numbers, but\n%$$%only the defaults have ever been built.\n%$$%\n%$$%The final dispenser consists of two parts which slide into each other. You %$$%can mount\n%$$%a hook to hang it into a tree. All edges that have angles different from 90 %$$%degrees (chamfers)\n%$$%have engraved guiding lines which indicate the angle. You have to sand the %$$%edge such\n%$$%that the pieces fit together.\n%$$%\n%$$%The top part (roof) consists of the the following elements for a N sided %$$%dispenser:\n%$$%\n%$$%  * The N sided roof bottom plate which supports the roof tiles. It has a %$$%central cut out\n%$$%    which is needed for assembly and on the bottom side an engraved line %$$%which indicates the\n%$$%    position of the mounting bracket.\n%$$%  * N triangles forming the roof. They also have a small arc at the tip %$$%(roof_hole_diameter)\n%$$%  which acts as a drilling guide if you want to mount a hook.\n%$$%  * The N sided roof support piece which has a central hole for the hook. It %$$%is been mounted\n%$$%  to the roof tiles through the hole in the roof bottom plate to support the %$$%roof\n%$$%  tiles and acts as a mounting plate for the hook.\n%$$%  * Spacer(s); in the reference builds 2 spacers using 3mm plywood have been %$$%used. The spacer\n%$$%  needs to be a bit thicker than the ceiling (see below). That's the %$$%smaller\n%$$%  \""U\"" shaped part which is glued to the bottom side of the roof bottom %$$%plate.\n%$$%  * The bracket is also \""U\"" shaped and a bit wider than the spacer. This %$$%is glued to the\n%$$%  bottom of the spacer and holds the cage (bottom part).\n%$$%\n%$$%The bottom part (cage) consists of the follwoing elements:\n%$$%\n%$$%  * The ceiling is N sided with the central refill hole and N smaller holes %$$%into which\n%$$%  the poles are fitted.\n%$$%  * The N sided floor part with finger joints for the balcony walls and %$$%holes for\n%$$%  the poles. A central hole to drain rain water can be added as well.\n%$$%  * N balcony walls surrounding the floor.\n%$$%  * N poles that join floor and ceiling (not part of the drawing)\n%$$%\n%$$%Other parts needed for assembly:\n%$$%\n%$$%  * Wooden rod (N times the length of the poles).\n%$$%  * A hook (e.g. M5x50mm)\n%$$%  * A washer to distribute the load of the hook to the support piece\n%$$%  * One or two nuts to secure the hook\n%$$%  * Optional, a pice of wire mesh\n%$$%\n%$$%Assembly:\n%$$%\n%$$%  * Sand all chamfers\n%$$%  * Glue balcony walls to the floor\n%$$%  * Glue pairs of roof tiles and use the roof bottom plate as a jig, Hot %$$%glue may be used to\n%$$%    tack the parts.\n%$$%  * Glue all roof tiles to form the roof\n%$$%  * Glue spacer(s) and the bracket into a stack\n%$$%  * Glue roof tiles to the roof bottom plate and attach the support piece\n%$$%  * Glue the stack to the roof bottom plate\n%$$%  * Cut the poles to length\n%$$%  * If you want to use multiple colors paint now, otherwise you also can %$$%paint later\n%$$%  * After painting you may need to get the paint out of the pole holes again %$$%using a drillbit\n%$$%  * Glue the poles into floor plate and ceiling\n%$$%  * Attach the hanger\n%$$%  * Attach the wire mesh\n%$$%    ",
The diameter of the fat balls. Give some extra mm to make it a loose fit,
The diameter of the hole of the floor (to drain rainwater)\n%$$%                    in mm. Set to 0 if you don't need it.,
The minimum distance between a pole and the central\n%$$%                    refill hole in the ceiling in mm.,
The gap between the parts that slide into each other\n%$$%                    in the locking mechanism in mm.,
The fraction of the pole clearance which is being used for\n%$$%                    the locking mechanism.,
The diameter of the hole of the roof in mm.\n%$$%                    Set to 0 if you don't want to attach a hanger.,
The distance from on bottom corner of the roof to the maintenance hole in mm.,
"\n%$$%Use small nails to properly align the pieces of the bayonet latch. Glue the %$$%parts of the bayonet latch before assembling the \""axle\"". The inner parts %$$%go at the side and the outer parts at the inside of the axle.\n%$$%![opened spool](static/samples/FilamentSpool-2.jpg)",
"\n%$$%If you have an enclosure, arrange the living hinge to be as close to your %$$%extractor fan as possible.\n%$$%\n%$$%![Open](static/samples/FlexBook-2.jpg)",
